<?xml version="1.0" encoding="utf-8"?>

<!-- Schema for national parks -->
<xs:schema xmlns:xs="http://www.w3.org/2001/XMLSchema">

    <!-- Main element -->
    <xs:element name="NationalParks">
        <xs:complexType>
            <xs:sequence>

                <!-- We can have many national parks -->
                <xs:element name="NationalPark" maxOccurs="unbounded">
                    <xs:complexType>
                        <xs:sequence>

                            <!-- Park name -->
                            <xs:element name="name" type="xs:string"/>

                            <!-- Park phone numbers -->
                            <xs:element name="phone" type="xs:string" maxOccurs="unbounded"/>

                            <!-- Park address -->
                            <xs:element name="address">
                                <xs:complexType>
                                    <xs:sequence>
                                        <xs:element name="number" type="xs:int"/>
                                        <xs:element name="street" type="xs:string"/>
                                        <xs:element name="city" type="xs:string"/>
                                        <xs:element name="state" type="xs:string"/>
                                        <xs:element name="zip" type="xs:string"/>
                                    </xs:sequence>

                                    <!-- Airport is required -->
                                    <xs:attribute name="nearestAirport" type="xs:string" use="required"/>
                                </xs:complexType>
                            </xs:element>

                        </xs:sequence>

                        <!-- Rating is optional -->
                        <xs:attribute name="rating" type="xs:decimal" use="optional"/>
                    </xs:complexType>
                </xs:element>

            </xs:sequence>
        </xs:complexType>
    </xs:element>

</xs:schema>
