<?xml version="1.0" encoding="utf-8"?>

<!-- My national parks list with errors -->

<!-- Error 1: Wrong root name -->
<NationalPark
    xmlns:xsi="http://www.w3.org/2001/XMLSchema-instance"
    xsi:noNamespaceSchemaLocation="https://sunnyal99.github.io/CSE445-Assignment4/NationalParks.xsd">

    <!-- Park 1 -->
    <NationalPark rating="4.9">
        <name>Grand Canyon</name>
        <phone>928-638-7496</phone>
        <phone>888-297-2757</phone>
        <phone>866-499-2574</phone>

        <address nearestAirport="FlagStaff">
            <number>8</number>
            <street>S Entrance Road</street>
            <city>Grand Canyon</city>
            <state>AZ</state>
            <zip>86023</zip>
        </address>
    </NationalPark>

    <!-- Park 2 -->
    <NationalPark>
        <name>Saguaro National Park</name>
        <phone>520-733-5153</phone>
        <phone>520-733-5158</phone>

        <!-- Error 2: Missing airport attribute -->
        <address>
            <number>3693</number>
            <street>S Old Spanish Trail</street>
            <city>Tucson</city>
            <state>AZ</state>
            <zip>85730</zip>
        </address>
    </NationalPark>

    <!-- Park 3 -->
    <NationalPark>
        <name>Yellowstone National Park</name>

        <!-- Error 3: Missing phone -->

        <address nearestAirport="Yellowstone Airport">
            <number>2</number>
            <street>Officers Row</street>
            <city>Yellowstone National Park</city>
            <state>WY</state>
            <zip>82190</zip>
        </address>
    </NationalPark>

    <!-- Park 4 -->
    <NationalPark>
        <name>Olympic National Park</name>
        <phone>360-565-3130</phone>

        <!-- Error 4: Missing address closing tag -->
        <address nearestAirport="William R. Fairchild International Airport">
            <number>3002</number>
            <street>Mount Angeles Road</street>
            <city>Port Angeles</city>
            <state>WA</state>
            <zip>98362</zip>

    </NationalPark>

    <!-- Park 5 -->
    <NationalPark>

        <!-- Error 5: Two names -->
        <name>Mesa Verde National Park</name>
        <name>Mesa Verde</name>

        <phone>970-529-4465</phone>

        <address nearestAirport="Cortez Municipal Airport">
            <number>34840</number>
            <street>Hwy 160</street>
            <city>Mancos</city>
            <state>CO</state>
            <zip>81328</zip>
        </address>
    </NationalPark>

    <!-- Park 6 -->
    <NationalPark>
        <name>Guadalupe Mountains National Park</name>
        <phone>915-828-3251</phone>

        <address nearestAirport="El Paso International Airport">
            <number>400</number>
            <street>Pine Canyon Drive</street>
            <city>Salt Flat</city>
            <state>TX</state>
            <zip>79847</zip>
        </address>
    </NationalPark>

    <!-- Park 7 -->
    <NationalPark rating="4.8">
        <name>Hawaii Volcanoes National Park</name>
        <phone>808-985-6011</phone>

        <address nearestAirport="Hilo International Airport">
            <number>1</number>
            <street>Crater Rim Drive</street>
            <city>Hawaii National Park</city>
            <state>HI</state>
            <zip>96718</zip>
        </address>
    </NationalPark>

    <!-- Park 8 -->
    <NationalPark>
        <name>Kobuk Valley National Park</name>
        <phone>907-318-2230</phone>

        <address nearestAirport="Ralph Wien Memorial Airport">
            <number>171</number>
            <street>Third Ave</street>
            <city>Kotzebue</city>
            <state>AK</state>
            <zip>99752</zip>
        </address>
    </NationalPark>

    <!-- Park 9 -->
    <NationalPark>
        <name>Everglades National Park</name>
        <phone>305-242-7700</phone>

        <address nearestAirport="Miami Homestead General Aviation Airport">
            <number>40001</number>
            <street>State Road 9336</street>
            <city>Homestead</city>
            <state>FL</state>
            <zip>33034</zip>
        </address>
    </NationalPark>

    <!-- Park 10 -->
    <NationalPark rating="4.7">
        <name>Rocky Mountain National Park</name>
        <phone>970-586-1206</phone>

        <address nearestAirport="Denver International Airport">
            <number>1000</number>
            <street>US Highway 36</street>
            <city>Estes Park</city>
            <state>CO</state>
            <zip>80517</zip>
        </address>
    </NationalPark>

    <!-- Park 11 -->
    <NationalPark>
        <name>Shenandoah National Park</name>
        <phone>540-999-3500</phone>

        <address nearestAirport="Shenandoah Valley Regional Airport">
            <number>3655</number>
            <street>US Highway 211 East</street>
            <city>Luray</city>
            <state>VA</state>
            <zip>22835</zip>
        </address>
    </NationalPark>

</NationalPark>
